batch_id,stock_code,corp_code,company_name,event_category,event_code,event_name,has_event,rcept_no,rcept_date,source_bgn_de,source_end_de,report_url,source_api,summary,details_json,collected_at
kosdaq_004,360070,01360875,탑머티리얼,mna,tangible_asset_acquisition,유형자산 양수 결정,true,20251211000340,2025-12-11,20190101,20260512,https://dart.fss.or.kr/dsaf001/main.do?rcpNo=20251211000340,tgastInhDecsn.json,bddd=2023년 09월 11일 | od_a_at_t=2 | od_a_at_b=0 | adt_a_atn=참석 | ftc_stt_atn=미해당,"{""adt_a_atn"": ""참석"", ""aprskh_ctref"": ""-"", ""aprskh_ex_pc_mth_pd_pl"": ""-"", ""aprskh_exrq"": ""-"", ""aprskh_lmt"": ""-"", ""aprskh_plnprc"": ""-"", ""aprskh_pym_plpd_mth"": ""-"", ""ast_nm"": ""경기도 평택시 브레인시티 일반산업단지 \n14-3, 14-4"", ""ast_sen"": ""토지 및 건물"", ""bddd"": ""2023년 09월 11일"", ""corp_cls"": ""K"", ""corp_code"": ""01360875"", ""corp_name"": ""탑머티리얼"", ""dl_pym"": ""- 계약보증금 : 20,000,000 (계약체결일)\n- 계약금 : 2,584,365,000 (2023.09.11)\n- 중도금 1차 : 3,906,547,500 (2023.12.13)\n- 중도금 2차 : 3,906,547,500 (2024.06.13)\n- 중도금 3차 : 3,906,547,500 (2024.12.13)\n- 잔금 : 11,719,642,500 (2025.02.25)"", ""dlptn_cmpnm"": ""평택도시공사"", ""dlptn_cpt"": ""404,032,510,000"", ""dlptn_hoadd"": ""경기도 평택시 도일유통길 25"", ""dlptn_mbsn"": ""산업단지 개발 및 분양업"", ""dlptn_rl_cmpn"": ""-"", ""exevl_atn"": ""미해당"", ""exevl_bs_rs"": ""본 건 용지는 평택도시공사의 산업시설용지 공급 공고에 의해 분양 받은 것으로, 증권의 발행 및 공시 등에 관한 규정 제5-14조의2(외부평가기관의 평가면제 등) 제3호에서 정한 평가 필요성이 적은 경우에 해당됨."", ""exevl_intn"": ""-"", ""exevl_op"": ""-"", ""exevl_pd"": ""-"", ""ftc_stt_atn"": ""미해당"", ""gmtsck_prd"": ""-"", ""gmtsck_spd_atn"": ""미해당"", ""inh_af"": ""매출 및 수익성 증대"", ""inh_pp"": ""생산시설 확충을 위한 산업단지 내 용지 분양"", ""inh_prd_ctr_cnsd"": ""2023년 09월 11일"", ""inh_prd_inh_std"": ""2025년 02월 25일"", ""inh_prd_rgs_prd"": ""2027년 01월 31일"", ""inhdtl_inhprc"": ""26,043,650,000"", ""inhdtl_tast"": ""121,399,594,465"", ""inhdtl_tast_vs"": ""21.45"", ""od_a_at_b"": ""0"", ""od_a_at_t"": ""2"", ""popt_ctr_atn"": ""아니오"", ""popt_ctr_cn"": ""-"", ""rcept_no"": ""20251211000340""}",2026-05-12T12:14:37
kosdaq_004,361390,01014718,제노코,mna,tangible_asset_acquisition,유형자산 양수 결정,true,20210610000100,2021-06-10,20190101,20260512,https://dart.fss.or.kr/dsaf001/main.do?rcpNo=20210610000100,tgastInhDecsn.json,bddd=2021년 06월 07일 | od_a_at_t=2 | od_a_at_b=0 | adt_a_atn=참석 | ftc_stt_atn=미해당,"{""adt_a_atn"": ""참석"", ""aprskh_ctref"": ""-"", ""aprskh_ex_pc_mth_pd_pl"": ""-"", ""aprskh_exrq"": ""-"", ""aprskh_lmt"": ""-"", ""aprskh_plnprc"": ""-"", ""aprskh_pym_plpd_mth"": ""-"", ""ast_nm"": ""경기도 군포시 당정동 18-15, 19\n다비치테크노타워"", ""ast_sen"": ""토지 및 건물"", ""bddd"": ""2021년 06월 07일"", ""corp_cls"": ""K"", ""corp_code"": ""01014718"", ""corp_name"": ""제노코"", ""dl_pym"": ""1.매매대금: \n  금일백오십칠억원(15,700,000,000원)\n\n2.대금지급기준:\n  청약금: 금오억원(500,000,000원) \n  계약금(매매대금의 10%): 금일십억칠천만원(1,070,000,000원)\n  중도금(매매대금의 40%): 금육십이억팔천만원(6,280,000,000원)\n  잔   금(매매대금의 50%): 금칠십팔억오천만원(7,850,000,000원)\n\n* 계약금은 매매대금의 10% 중 청약금을 제외한 금액입니다."", ""dlptn_cmpnm"": ""(주)다비치홀딩스"", ""dlptn_cpt"": ""307,010,000"", ""dlptn_hoadd"": ""서울특별시 중구 소공로62, 1층\n(충무로1가, 동암빌딩)"", ""dlptn_mbsn"": ""부동산 개발 및 공급, 안경사업"", ""dlptn_rl_cmpn"": ""-"", ""exevl_atn"": ""예"", ""exevl_bs_rs"": ""자본시장과 금융투자에 관한 법률 제161조 제1항 제7호 및 동법시행령 제171조 제2항 제5호에 의한 적정성 평가"", ""exevl_intn"": ""대성삼경회계법인"", ""exevl_op"": ""적정"", ""exevl_pd"": ""2021년 06월 08일 ~ 2021년 06월 09일"", ""ftc_stt_atn"": ""미해당"", ""gmtsck_prd"": ""-"", ""gmtsck_spd_atn"": ""미해당"", ""inh_af"": ""-"", ""inh_pp"": ""1.상장사로서 대외 이미지 제고\n2.현 사업 생산능력(시설, 장비) 검증을 통한 양산 물량 수주\n3.향 후 신규사업 진행을 위한 신규아이템에 대한 생산시설 확충\n4.현 임차건물의 공간협소 한계상황 극복"", ""inh_prd_ctr_cnsd"": ""2021년 06월 15일"", ""inh_prd_inh_std"": ""2021년 08월 27일"", ""inh_prd_rgs_prd"": ""2021년 09월 10일"", ""inhdtl_inhprc"": ""15,700,000,000"", ""inhdtl_tast"": ""28,671,898,274"", ""inhdtl_tast_vs"": ""54.76"", ""od_a_at_b"": ""0"", ""od_a_at_t"": ""2"", ""popt_ctr_atn"": ""아니오"", ""popt_ctr_cn"": ""-"", ""rcept_no"": ""20210610000100""}",2026-05-12T12:14:37
kosdaq_004,362990,01492688,드림인사이트,mna,tangible_asset_acquisition,유형자산 양수 결정,true,20240703000230,2024-07-03,20190101,20260512,https://dart.fss.or.kr/dsaf001/main.do?rcpNo=20240703000230,tgastInhDecsn.json,bddd=2024년 07월 03일 | od_a_at_t=3 | adt_a_atn=참석 | ftc_stt_atn=미해당 | inh_pp=사업규모 확대에 따른 시설확장,"{""adt_a_atn"": ""참석"", ""aprskh_ctref"": ""-"", ""aprskh_ex_pc_mth_pd_pl"": ""-"", ""aprskh_exrq"": ""-"", ""aprskh_lmt"": ""-"", ""aprskh_plnprc"": ""-"", ""aprskh_pym_plpd_mth"": ""-"", ""ast_nm"": ""부산광역시 해운대구 재송동 1208-2  제에이401호~405호"", ""ast_sen"": ""토지 및 건물"", ""bddd"": ""2024년 07월 03일"", ""corp_cls"": ""K"", ""corp_code"": ""01492688"", ""corp_name"": ""드림인사이트"", ""dl_pym"": ""1) 지급형태 : 현금\n\n2) 자금조달 방법 : 보유자금 및 차입\n\n3) 지급시기 및 조건\n\n - 계약금 :    440,000,000원 (2024.07.03)\n\n - 중도금 : 1,350,000,000원 (2024.08.16)\n\n - 잔   금 : 2,710,000,000원 (2024.09.30)"", ""dlptn_cmpnm"": ""1) (주)한길구조\n2) (주)부경비디에스"", ""dlptn_cpt"": ""20,000,000"", ""dlptn_hoadd"": ""1) (주)한길구조 (부산광역시 해운대구 센텀중앙로 97, 에이동 401호)\n2) (주)부경비디에스(부산광역시 해운대구 센텀중앙로 97, 에이동 에이-402호)"", ""dlptn_mbsn"": ""건축물 및 시설물에 대한 구조설계 및 감리업\n건축엔지니어링 서비스업"", ""dlptn_rl_cmpn"": ""-"", ""exevl_atn"": ""예"", ""exevl_bs_rs"": ""1) 근거 : 자본시장과 금융투자업에 관한 법률 제161조 제1항 제7호 및   동법시행령 제171조 제2항 제5호에 의한 적정성 평가\n\n\n2)사유 : 회사가 양수하기로 하는 계약과 관련하여 양수가액의 적정성  여부를판단하기 위한 외부평가기관의 참고 자료 제공"", ""exevl_intn"": ""회계법인 이상"", ""exevl_op"": ""적정"", ""exevl_pd"": ""2024년 06월 24일 ~ 2024년 07월 03일"", ""ftc_stt_atn"": ""미해당"", ""gmtsck_prd"": ""-"", ""gmtsck_spd_atn"": ""미해당"", ""inh_af"": ""부산지사의 업무공간 확장에 따른 경영환경 개선"", ""inh_pp"": ""사업규모 확대에 따른 시설확장"", ""inh_prd_ctr_cnsd"": ""2024년 07월 03일"", ""inh_prd_inh_std"": ""2024년 09월 30일"", ""inh_prd_rgs_prd"": ""2024년 09월 30일"", ""inhdtl_inhprc"": ""4,500,000,000"", ""inhdtl_tast"": ""35,255,973,619"", ""inhdtl_tast_vs"": ""12.76"", ""od_a_at_b"": ""-"", ""od_a_at_t"": ""3"", ""popt_ctr_atn"": ""아니오"", ""popt_ctr_cn"": ""-"", ""rcept_no"": ""20240703000230""}",2026-05-12T12:14:37
kosdaq_004,363260,01493535,모비데이즈,mna,merger_decision,회사합병 결정,true,20220317000025,2022-03-17,20190101,20260512,https://dart.fss.or.kr/dsaf001/main.do?rcpNo=20220317000025,cmpMgDecsn.json,bddd=2021년 09월 17일 | od_a_at_t=1 | adt_a_atn=참석 | rs_sm_atn=예 | exevl_atn=예,"{""adt_a_atn"": ""참석"", ""aprskh_ctref"": "" 각 당사회사 중 어느 한 곳 이상에서 본건 합병에 반대하여 주식매수청구권을 행사하는 주식의 합계가 발행주식총수의 [33.33%]를 초과하는 경우, 존속회사 또는 소멸회사의 이사회는 본건 합병을 계속 진행하지 않고 합병 계약을 해제할 것을 결정할 수 있습니다.\n또한 본 합병은 합병기일 이전에 주식매수청구 결과 매수대금의 합이 각각 일정금액 이상일 경우 합병계약의 효력에 영향을 미칠 수 있습니다."", ""aprskh_plnprc"": ""-"", ""aprskh_pym_plpd_mth"": ""(1) 주식매수대금의 지급예정시기\n- 하나금융17호기업인수목적(주)\n   : 주식매수의 청구 기간이 종료하는 날로부터 1개월 이내에 지급할 예정\n- (주)모비데이즈\n    : 주식매수의 청구 기간이 종료하는 날로부터 2개월 이내에 지급할 예정\n\n(2) 지급방법\n- 명부주주에 등재된 주주 : 현금지급 또는 주주의 신고계좌로 이체\n- 주권을 증권회사에 위탁하고 있는 실질주주 : 해당 거래 증권회사의 본인계좌로 이체"", ""bddd"": ""2021년 09월 17일"", ""bdlst_atn"": ""해당사항없음"", ""corp_cls"": ""K"", ""corp_code"": ""01493535"", ""corp_name"": ""모비데이즈"", ""eadtat_intn"": ""삼일회계법인"", ""eadtat_op"": ""적정"", ""ex_sm_r"": ""-"", ""exevl_atn"": ""예"", ""exevl_bs_rs"": ""합병과 관련하여 합병법인이 자본시장과 금융투자업에관한 법률의 규정에 따라 관련 신고서를 제출할 때 첨부서류로 이용하기 위함"", ""exevl_intn"": ""한미회계법인"", ""exevl_op"": ""합병법인이 피합병법인을 합병함에 있어서 합병비율의 기준이 되는 합병당사회사의 주당평가액은 합병법인과 피합병법인이 각각 2,000원(액면가액 100원)과 28,930원(액면가액 100원)으로 추정되었으며, 합병당사회사가 합의한 합병비율 1 : 14.4650000은 적정한 것으로 판단됩니다.\n\n본 평가인의 검토 결과 이러한 합병비율은 중요성의 관점에서 자본시장과금융투자업에관한법률 제165조의 4, 동법 시행령 제176조의 5, 증권의발행및공시등에관한규정 제5-13조 및 동 규정 시행세칙 제4조 내지 제8조에서 규정하고 있는 합병가액 산정방법에 위배되어 산정되었다는 점이 발견되지 아니하였습니다"", ""exevl_pd"": ""2021년 07월 30일 ~ 2021년 09월 16일"", ""ffdtl_cpt"": ""-"", ""ffdtl_std"": ""-"", ""ffdtl_tast"": ""-"", ""ffdtl_tdbt"": ""-"", ""ffdtl_teqt"": ""-"", ""mg_mth"": ""코스닥시장 상장법인 하나금융17호기업인수목적(주)가 \n비상장법인인 (주)모비데이즈를 흡수합병함"", ""mg_pp"": ""1) 기업공개를 통한 경영투명성 강화2) 기업가치의 공정한 평가3) 재무건전성 강화를 통한 주주의 권익 향상4) 상장을 통한 회사의 사회적 책임 구현5) 홍보효과 및 기업평가를 통한 국내외 관련업체와의 제휴6) 회사의 인지도 향상을 통한 경쟁력 강화 및 우수인재 확보7) 임직원 자긍심 고취 및 사기 진작"", ""mg_rt"": ""하나금융17호기업인수목적(주) : (주)모비데이즈 = 1 : 14.4650000"", ""mg_rt_bs"": ""\n합병법인의 합병가액 산정\n\n주권상장법인의 합병가액은 원칙적으로 기준시가를 적용하되, 기준시가가 자산가치보다 낮은 경우에는 자산가치로 할 수 있도록 되어 있습니다. 본 건 합병법인의 합병가액은 자산가치보다 기준주가에 할인율을 반영한 평가가액이 높기에 본 평가에서는 기준주가에 할인율을 반영한 평가가액을 합병가액으로 산정하였습니다.\n\nA. 기준주가에 할인율을 반영한 평가가액 : 2,000원\nB. 자산가치 : 326원\nC. 합병가액 (Max[A, B]) : 2,000원\n\n(1) 합병법인의 기준주가 산정\n합병법인의 기준주가에 할인율을 반영한 평가가액은 자본시장과금융투자업에관한법률시행령 제176조의5 제1항제1호에 따라 합병을 위한 이사회 결의일(2021년9월17일)과 합병계약을 체결한 날(2021년9월17일) 중 앞서는 날의 전일(2021년9월 16일)을 기산일(영업일 기준)로 한 최근1개월간의 거래량 가중산술평균종가, 최근1주일간의 거래량 가중산술평균종가, 최근일의 종가를 산술평균한 가액을 기준으로100분의30(계열회사간 합병의 경우에는100분의10)의 범위에서 할인 또는 할증한 가액(본건 합병에서는 28.01% 할인한 가액)으로 산정하였습니다.  \n본 합병의 경우 합병을 위한 이사회 결의일과 합병계약을 체결한 날 모두 2021년 9월 17일이므로 합병을 위한 이사회 결의일의 전일인 2021년 9월 16일(영업일 기준)이 기산일입니다. 최근 1개월 가중산술평균종가는 2021년 8월 18일부터 2021년 9월16일까지의 종가와 거래량을 이용하며 최근 1주일 가중산술평균종가는 2021년 9월 10일부터 2021년 9월 16일까지의 종가와 거래량을 이용합니다.\n\nA. 2021년 08월 18일부터 2021년 09월 16일까지 :  2,775원B. 2021년 09월 10일부터 2021년 09월 16일까지 : 2,749원C. 2021년 9월 16일 : 2,810원D. 산술평균주가([A+B+C]÷3) : 2,778원\nE. 할증(할인)율 : 28.01%\nF. 기준주가(Dx[1+E]): 2,000원\n\n(2) 합병법인의 자산가치 산정\n\n합병법인의 1주당 자산가치는 증권의발행및공시등에관한규정시행세칙 제5조에 따라 주요사항보고서를 제출하는 날이 속하는 사업연도의 직전 사업연도말 현재의 한국채택국제회계기준에 의해 감사받은 개별재무제표상의 자본총계에서 일부 조정항목을 가감하여 산정된 순자산가액을 분석기준일 현재의 발행주식총수로 나누어 산정하였습니다. 합병법인의 1주당 자산가치 산정내역은 다음과 같습니다.\n\nA. 최근 사업연도말 자본총계 : 876,140,518원\nB. 조정항목(a - b) : 1,990,000,000\n   a. 가산항목 : 1,990,000,000\n   b. 차감항목 : -\nC. 조정된 순자산가액 (A + B) :2,866,140,518원\nD. 발행주식총수 : 8,800,000주\nE. 1주당 자산가치 (C ÷ D) : 326원\n\n2. 피합병법인의 합병가액 산정\n\n자본시장과금융투자업에관한법률시행령 제176조의5 1항에 의하면, 비상장법인인 피합병법인의 합병가액은 본질가치(자산가치와 수익가치를 각각 1과 1.5의 비율로 가중산술평균한 가액)로 평가하도록 규정하고 있는 바, 본 평가에서는 자본시장과금융투자업에관한법률시행령 제176조의5 3항에 의거 피합병법인이 비상장법인인 경우 기업인수목적회사와 협의하여 정하는 가격인 자산가치와 수익가치를 각각 1과 1.5의 비율로 가중산술평균한 본질가치를 적용하였습니다.\n\nA. 본질가치[(aX1+bX1.5)÷2.5] :  28,930 원\n   a. 자산가치 :  1,415원\n   b. 수익가치 : 47,270원\nB. 상대가치 : 해당사항 없음(유사회사 3개 미만)\nC. 합병가액: 28,930원\n\n3. 산출결과\n\n합병법인이 피합병법인을 합병함에 있어서 합병비율의 기준이 되는 양 합병당사회사의 주당평가액은 합병법인과 피합병법인이 각각 2,000원(액면가액 100원)과 28,930원(액면가액 100원)으로 추정되었으며, 이에 따라 합병 당사회사의 합병비율은 1:14.4650000으로 산정되었습니다"", ""mg_stn"": ""해당사항없음"", ""mgnstk_cstk_cnt"": ""-"", ""mgnstk_ostk_cnt"": ""152,018,847"", ""mgptncmp_cmpnm"": ""주식회사 모비데이즈"", ""mgptncmp_mbsn"": ""온라인 광고대행업"", ""mgptncmp_rl_cmpn"": ""-"", ""mgsc_aprskh_expd_bgd"": ""2022년 04월 13일"", ""mgsc_aprskh_expd_edd"": ""2022년 05월 03일"", ""mgsc_cdobprpd_bgd"": ""2022년 04월 14일"", ""mgsc_cdobprpd_edd"": ""2022년 05월 16일"", ""mgsc_ergmd"": ""2022년 05월 17일"", ""mgsc_gmtsck_prd"": ""2022년 04월 13일"", ""mgsc_mgctrd"": ""2021년 09월 17일"", ""mgsc_mgdt"": ""2022년 05월 17일"", ""mgsc_mgop_rcpd_bgd"": ""2022년 03월 29일"", ""mgsc_mgop_rcpd_edd"": ""2022년 04월 12일"", ""mgsc_mgrgsprd"": ""2022년 05월 18일"", ""mgsc_nstkdlprd"": ""-"", ""mgsc_nstklstprd"": ""2022년 06월 08일"", ""mgsc_osprpd_bgd"": ""-"", ""mgsc_osprpd_edd"": ""-"", ""mgsc_shclspd_bgd"": ""2022년 03월 18일"", ""mgsc_shclspd_edd"": ""2022년 03월 25일"", ""mgsc_shddstd"": ""2022년 03월 17일"", ""mgsc_trspprpd_bgd"": ""-"", ""mgsc_trspprpd_edd"": ""-"", ""nmgcmp_cmpnm"": ""-"", ""nmgcmp_mbsn"": ""-"", ""nmgcmp_nbsn_rsl"": ""-"", ""nmgcmp_rlst_atn"": ""해당사항없음"", ""od_a_at_b"": ""-"", ""od_a_at_t"": ""1"", ""otcpr_bdlst_sf_atn"": ""해당사항없음"", ""popt_ctr_atn"": ""아니오"", ""popt_ctr_cn"": ""-"", ""rbsnfdtl_cpt"": ""867,225,000"", ""rbsnfdtl_nic"": ""3,210,878,311"", ""rbsnfdtl_sl"": ""14,641,150,926"", ""rbsnfdtl_tast"": ""44,060,123,615"", ""rbsnfdtl_tdbt"": ""41,343,241,081"", ""rbsnfdtl_teqt"": ""2,716,882,534"", ""rcept_no"": ""20220317000025"", ""rs_sm_atn"": ""예""}",2026-05-12T12:14:37
kosdaq_004,364950,01307593,에이아이코리아,mna,tangible_asset_acquisition,유형자산 양수 결정,true,20260327001652,2026-03-27,20190101,20260512,https://dart.fss.or.kr/dsaf001/main.do?rcpNo=20260327001652,tgastInhDecsn.json,bddd=2026년 03월 27일 | od_a_at_t=1 | od_a_at_b=0 | adt_a_atn=참석 | ftc_stt_atn=미해당,"{""adt_a_atn"": ""참석"", ""aprskh_ctref"": ""-"", ""aprskh_ex_pc_mth_pd_pl"": ""-"", ""aprskh_exrq"": ""-"", ""aprskh_lmt"": ""-"", ""aprskh_plnprc"": ""-"", ""aprskh_pym_plpd_mth"": ""-"", ""ast_nm"": ""경기도 수원시 권선구 고색동 942번지 토지 및 건물 일체"", ""ast_sen"": ""토지 및 건물"", ""bddd"": ""2026년 03월 27일"", ""corp_cls"": ""K"", ""corp_code"": ""01307593"", ""corp_name"": ""에이아이코리아"", ""dl_pym"": ""1. 지급형태 : 현금\n2. 거래대금 : 9,000,000,000원\n3. 지급시기 및 지급조건:\n 1) 계약금 : 900,000,000원 (2026.03.27)\n 2) 잔금 : 8,100,000,000원 (2026.04.27)\n4. 자금조달 방법 : 당사 보유자금 및 차입금을 통한 조달"", ""dlptn_cmpnm"": ""(주)에이아이이"", ""dlptn_cpt"": ""100,000,000"", ""dlptn_hoadd"": ""경기도 수원시 권선구 고색동 942번지 "", ""dlptn_mbsn"": ""반도체 및 LCD, OLED 생산장비와 기타 전자부품 등의 제조, 판매"", ""dlptn_rl_cmpn"": ""계열회사"", ""exevl_atn"": ""예"", ""exevl_bs_rs"": ""- 자본시장과 금융투자업에 관한 법률 제161조 제1항 제7호 및\n동법 시행령 제171조 제2항 제5호에 의한 적정성 평가\n- 양수도 가액의 적정성 여부를 판단하기 위한 참고자료 확보"", ""exevl_intn"": ""이상 회계법인"", ""exevl_op"": ""적정"", ""exevl_pd"": ""2026년 03월 16일 ~ 2026년 03월 27일"", ""ftc_stt_atn"": ""미해당"", ""gmtsck_prd"": ""-"", ""gmtsck_spd_atn"": ""미해당"", ""inh_af"": ""중, 장기적 자산 가치 제고"", ""inh_pp"": ""사업 확장에 따른 업무 공간 확보 및 본사 이전"", ""inh_prd_ctr_cnsd"": ""2026년 03월 27일"", ""inh_prd_inh_std"": ""2026년 04월 27일"", ""inh_prd_rgs_prd"": ""2026년 04월 27일"", ""inhdtl_inhprc"": ""9,000,000,000"", ""inhdtl_tast"": ""85,813,340,955"", ""inhdtl_tast_vs"": ""10.49"", ""od_a_at_b"": ""0"", ""od_a_at_t"": ""1"", ""popt_ctr_atn"": ""아니오"", ""popt_ctr_cn"": ""-"", ""rcept_no"": ""20260327001652""}",2026-05-12T12:14:37
kosdaq_004,365270,01397772,큐라클,mna,tangible_asset_acquisition,유형자산 양수 결정,true,20211101000288,2021-11-01,20190101,20260512,https://dart.fss.or.kr/dsaf001/main.do?rcpNo=20211101000288,tgastInhDecsn.json,bddd=2021년 11월 01일 | od_a_at_t=1 | adt_a_atn=참석 | ftc_stt_atn=미해당 | inh_pp=연구시설 및 업무시설 확보,"{""adt_a_atn"": ""참석"", ""aprskh_ctref"": ""-"", ""aprskh_ex_pc_mth_pd_pl"": ""-"", ""aprskh_exrq"": ""-"", ""aprskh_lmt"": ""-"", ""aprskh_plnprc"": ""-"", ""aprskh_pym_plpd_mth"": ""-"", ""ast_nm"": ""서울특별시 서초구 방배동 475-31번지\n(토지 512.4㎡, 건물 2,152.56㎡)"", ""ast_sen"": ""토지 및 건물"", ""bddd"": ""2021년 11월 01일"", ""corp_cls"": ""K"", ""corp_code"": ""01397772"", ""corp_name"": ""큐라클"", ""dl_pym"": ""1. 지급형태 : 현금지급\n2. 지급시기 및 조건\n - 계약금 : 1,650,000,000원(2021.11.01)\n - 중도금 : 6,600,000,000원(2021.11.30)\n - 잔   금 : 8,250,000,000원(2021.12.29)\n3. 자금조달 : 사내유보자금 및 금융기관차입"", ""dlptn_cmpnm"": ""주식회사 케이에이치"", ""dlptn_cpt"": ""300,000,000"", ""dlptn_hoadd"": ""경기도 여주시 장여로 1699(점봉동)"", ""dlptn_mbsn"": ""화장품 제조업"", ""dlptn_rl_cmpn"": ""-"", ""exevl_atn"": ""예"", ""exevl_bs_rs"": ""- 근거:자본시장과 금융투자에 관한 법률 제161조 제1항 제7호 및 동법시행령 제171조 제2항 제5호에 의거한 적정성 평가\n\n- 사유:회사가 양수하기로 의사 결정한 자산양수가액의 적정성 여부를 판단하기 위한 참고 자료 제공"", ""exevl_intn"": ""삼덕회계법인"", ""exevl_op"": ""적정"", ""exevl_pd"": ""2021년 10월 25일 ~ 2021년 11월 01일"", ""ftc_stt_atn"": ""미해당"", ""gmtsck_prd"": ""-"", ""gmtsck_spd_atn"": ""미해당"", ""inh_af"": ""연구개발인력 증가에 따른 공간 부족 문제 해결"", ""inh_pp"": ""연구시설 및 업무시설 확보"", ""inh_prd_ctr_cnsd"": ""2021년 11월 01일"", ""inh_prd_inh_std"": ""2021년 12월 29일"", ""inh_prd_rgs_prd"": ""2021년 12월 29일"", ""inhdtl_inhprc"": ""16,500,000,000"", ""inhdtl_tast"": ""12,687,272,949"", ""inhdtl_tast_vs"": ""130.05"", ""od_a_at_b"": ""-"", ""od_a_at_t"": ""1"", ""popt_ctr_atn"": ""아니오"", ""popt_ctr_cn"": ""-"", ""rcept_no"": ""20211101000288""}",2026-05-12T12:14:37
