batch_id,stock_code,corp_code,company_name,event_category,event_code,event_name,has_event,rcept_no,rcept_date,source_bgn_de,source_end_de,report_url,source_api,summary,details_json,collected_at
kosdaq_004,377480,01297898,마음AI,mna,merger_decision,회사합병 결정,true,20240826000105,2024-08-26,20190101,20260512,https://dart.fss.or.kr/dsaf001/main.do?rcpNo=20240826000105,cmpMgDecsn.json,bddd=2024년 05월 21일 | od_a_at_t=2 | od_a_at_b=0 | adt_a_atn=참석 | rs_sm_atn=아니오,"{""adt_a_atn"": ""참석"", ""aprskh_ctref"": ""-"", ""aprskh_plnprc"": ""-"", ""aprskh_pym_plpd_mth"": ""-"", ""bddd"": ""2024년 05월 21일"", ""bdlst_atn"": ""아니오"", ""corp_cls"": ""K"", ""corp_code"": ""01297898"", ""corp_name"": ""마음AI"", ""eadtat_intn"": ""-"", ""eadtat_op"": ""해당사항없음"", ""ex_sm_r"": ""1년간 보호예수"", ""exevl_atn"": ""예"", ""exevl_bs_rs"": ""자본시장과 금융투자업에 관한 법률 시행령 제176조의5 제7항 제2호 가목에 의거하여 주권상장법인이 비상장법인과 합병하는 경우로서, 주권상장법인이 동 시행령 제176조의5 제1항 제2호 나목에 따라 산정된 합병가액에 따르는 경우이므로 합병가액의 적정성에 대하여 외부평가기관의 평가를 받았습니다."", ""exevl_intn"": ""대성삼경회계법인"", ""exevl_op"": ""적정"", ""exevl_pd"": ""2024년 05월 02일 ~ 2024년 05월 20일"", ""ffdtl_cpt"": ""-"", ""ffdtl_std"": ""-"", ""ffdtl_tast"": ""-"", ""ffdtl_tdbt"": ""-"", ""ffdtl_teqt"": ""-"", ""mg_mth"": ""주식회사 마음에이아이가 주식회사 맨드언맨드를 흡수합병 \n1) 합병회사(존속회사) : 주식회사 마음에이아이 \n2) 피합병회사(소멸회사) : 주식회사 맨드언맨드"", ""mg_pp"": ""합병을 통한 사업 강화 및 효율화"", ""mg_rt"": ""주식회사 마음에이아이 : 주식회사 맨드언맨드 = 1 : 2.2095999"", ""mg_rt_bs"": ""본 건 합병은 상장법인과 비상장법인간의 합병으로, 합병회사인 주식회사 마음에이아이의 경우 코스닥시장 주권상장법인으로 \""자본시장과 금융투자업에 관한 법률\"" 제165조의 4 및 동법 시행령 제176조의 5 제 1항 제1호 및 제2호에 의거하여 합병가액을 산정하였으며, 피합병회사인 주식회사 맨드언맨드는 비상장법인으로 \""자본시장과 금융투자업에 관한 법률\"" 제165조의 4 및 동법 시행령제176조의5 제1항 제2호에 의거하여 자산가치와 수익가치를 가중산출평균한 가액을 합병가액으로 하여 이를 기초로 합병비율을 산정하였습니다.\n\n가. 합병회사 주식회사 마음에이아이 보통주 합병가액 \n\n주권상장법인인 합병회사의 기준시가는 「자본시장과 금융투자업에 관한 법률 시행령 」제176조의5에 따라 합병을 위한 이사회 결의일(2024년 5월 21일)과 합병계약을 체결한 날(2024년 5월 24일, 예정) 중 앞서는 날의 전일(2024년 5월 20일)을 기산일로 최근 1개월간의 거래량 가중산술평균종가, 최근 1주일간의 거래량 가중산술평균종가, 최근일의 종가를 산술평균한 가액으로 산정하였습니다. \n\n\n- 최근 1개월 가중산술평균종가(2024.4.22 ~ 2024.5.20) : 22,532원\n- 최근 1주일 가중산술평균종가(2024.5.14 ~ 2024.5.20) : 23,008원 \n- 최근일 종가(2024.5.20) : 22,350원 \n- 합병가액 : 22,630원\n\n나. 피합병회사 주식회사 맨드언맨드 보통주 합병가액 \n\n「자본시장과 금융투자업에 관한 법률 시행령」제176조의5에 의하여 비상장법인의 합병가액은 자산가치와 수익가치를 각각 1과 1.5의 비율로 가중산술평균한 가액(이하 \""본질가치\"")으로 산정하였으며 상대가치는 비교목적으로 분석하였으나 3개 이상의 유사회사가 존재하지 아니하여 상대가치를 산정하지 아니하였습니다. \n\n- 자산가치(a) : 6,765원 \n- 수익가치(b) : 78,829원 \n- 본질가치[(a*1+b*1.5)/2.5] : 50,003원 \n- 상대가치(c) : 해당사항 없음 \n- 합병가액 : 50,003원 \n\n합병가액에 대한 자세한 사항은 첨부서류 외부평가기관의 평가의견서를 참고하시기 바랍니다. \n\n상기와 같이 합병회사 주식회사 마음에이아이가 피합병회사 주식회사 맨드언맨드를 합병함에 있어서 합병비율의 기준이 되는 양 합병당사회사의 보통주 주당평가액은 주식회사 마음에이아이와 주식회사 맨드언맨드가 각각 22,630원(주당 액면가액 500원)과 50,003원(주당 액면가액 1,000원)으로 산정되었으며, 이에\n따라 합병비율은 주식회사 마음에이아이 : 주식회사 맨드언맨드  = 1 : 2.2095999 로 결정되었습니다."", ""mg_stn"": ""소규모합병"", ""mgnstk_cstk_cnt"": ""-"", ""mgnstk_ostk_cnt"": ""61,863"", ""mgptncmp_cmpnm"": ""주식회사 맨드언맨드"", ""mgptncmp_mbsn"": ""응용 소프트웨어 개발 및 공급업"", ""mgptncmp_rl_cmpn"": ""임직원겸직"", ""mgsc_aprskh_expd_bgd"": ""-"", ""mgsc_aprskh_expd_edd"": ""-"", ""mgsc_cdobprpd_bgd"": ""2024년 06월 25일"", ""mgsc_cdobprpd_edd"": ""2024년 07월 26일"", ""mgsc_ergmd"": ""2024년 08월 01일"", ""mgsc_gmtsck_prd"": ""-"", ""mgsc_mgctrd"": ""2024년 05월 24일"", ""mgsc_mgdt"": ""2024년 07월 31일"", ""mgsc_mgop_rcpd_bgd"": ""2024년 06월 05일"", ""mgsc_mgop_rcpd_edd"": ""2024년 06월 19일"", ""mgsc_mgrgsprd"": ""2024년 08월 05일"", ""mgsc_nstkdlprd"": ""-"", ""mgsc_nstklstprd"": ""2024년 08월 30일"", ""mgsc_osprpd_bgd"": ""-"", ""mgsc_osprpd_edd"": ""-"", ""mgsc_shclspd_bgd"": ""-"", ""mgsc_shclspd_edd"": ""-"", ""mgsc_shddstd"": ""2024년 06월 05일"", ""mgsc_trspprpd_bgd"": ""-"", ""mgsc_trspprpd_edd"": ""-"", ""nmgcmp_cmpnm"": ""-"", ""nmgcmp_mbsn"": ""-"", ""nmgcmp_nbsn_rsl"": ""-"", ""nmgcmp_rlst_atn"": ""해당사항없음"", ""od_a_at_b"": ""0"", ""od_a_at_t"": ""2"", ""otcpr_bdlst_sf_atn"": ""해당사항없음"", ""popt_ctr_atn"": ""아니오"", ""popt_ctr_cn"": ""-"", ""rbsnfdtl_cpt"": ""21,404,000"", ""rbsnfdtl_nic"": ""-50,203,591"", ""rbsnfdtl_sl"": ""173,383,457"", ""rbsnfdtl_tast"": ""263,508,673"", ""rbsnfdtl_tdbt"": ""74,088,259"", ""rbsnfdtl_teqt"": ""189,420,414"", ""rcept_no"": ""20240826000105"", ""rs_sm_atn"": ""아니오""}",2026-05-12T12:14:37
kosdaq_004,380540,01506990,옵티코어,mna,tangible_asset_acquisition,유형자산 양수 결정,true,20250702000588,2025-07-02,20190101,20260512,https://dart.fss.or.kr/dsaf001/main.do?rcpNo=20250702000588,tgastInhDecsn.json,bddd=2025년 07월 02일 | od_a_at_t=2 | od_a_at_b=1 | adt_a_atn=불참 | ftc_stt_atn=미해당,"{""adt_a_atn"": ""불참"", ""aprskh_ctref"": ""-"", ""aprskh_ex_pc_mth_pd_pl"": ""-"", ""aprskh_exrq"": ""-"", ""aprskh_lmt"": ""-"", ""aprskh_plnprc"": ""-"", ""aprskh_pym_plpd_mth"": ""-"", ""ast_nm"": ""서울시 서초구 서초동 1332-4번지, 2층 7개호실(토지 315.69\n㎡, 건물 1,406.19㎡)"", ""ast_sen"": ""토지 및 건물"", ""bddd"": ""2025년 07월 02일"", ""corp_cls"": ""K"", ""corp_code"": ""01506990"", ""corp_name"": ""옵티코어"", ""dl_pym"": ""1. 지급형태 : 현금\n\n\n2. 지급시기 및 조건\n\n- 계약금: 1,300,000,000 (2025.7.2)\n\n- 잔   금: 11,700,000,000 (2025.8.1)\n\n\n3. 자금조달방법 : 자기자금"", ""dlptn_cmpnm"": ""(주)그린홀딩스"", ""dlptn_cpt"": ""1,500,000,000"", ""dlptn_hoadd"": ""경기도 용인시 수지구 신수로 767"", ""dlptn_mbsn"": ""부동산매매업"", ""dlptn_rl_cmpn"": ""-"", ""exevl_atn"": ""예"", ""exevl_bs_rs"": ""1. 근거: 자본시장과 금융투자업에 관한 법률 제161조 제1항 제7호 및 동법 시행령 제171조 제2항 제5호에 따른 적정성 평가\n\n\n2. 사유: 회사가 양수하기로 의사결정한 자산양수가액의 적정성 여부를 판단하기 위한 참고자료 제공"", ""exevl_intn"": ""성송회계법인"", ""exevl_op"": ""적정"", ""exevl_pd"": ""2025년 06월 28일 ~ 2025년 07월 01일"", ""ftc_stt_atn"": ""미해당"", ""gmtsck_prd"": ""-"", ""gmtsck_spd_atn"": ""미해당"", ""inh_af"": ""자산 증대 및 임대수익 창출\n\n중장기 성장 대비 인프라 구축"", ""inh_pp"": ""업무환경 개선을 위한 토지 및 건물 취득\n\n자산 증대 및 임대수익 발생"", ""inh_prd_ctr_cnsd"": ""2025년 07월 02일"", ""inh_prd_inh_std"": ""2025년 08월 01일"", ""inh_prd_rgs_prd"": ""2025년 08월 01일"", ""inhdtl_inhprc"": ""13,000,000,000"", ""inhdtl_tast"": ""30,397,108,406"", ""inhdtl_tast_vs"": ""42.77"", ""od_a_at_b"": ""1"", ""od_a_at_t"": ""2"", ""popt_ctr_atn"": ""아니오"", ""popt_ctr_cn"": ""-"", ""rcept_no"": ""20250702000588""}",2026-05-12T12:14:37
kosdaq_004,382150,01423916,온코크로스,mna,merger_decision,회사합병 결정,true,20260415000702,2026-04-15,20190101,20260512,https://dart.fss.or.kr/dsaf001/main.do?rcpNo=20260415000702,cmpMgDecsn.json,"bddd=2026년 04월 15일 | od_a_at_t=1 | adt_a_atn=참석 | rs_sm_atn=아니오 | ex_sm_r=본 건 합병에 따른 쳥약의 권유자가 50인 미만에 해당하며, 증권의 발행 및 공시 등에 관한 규정 제2-2조 제2항 제1호에 의거 합병신주는 발행 후 지체없이 한국예탁결제원에 1년 이상의 기간동안 보호예수 예탁하여 해당증권을 인출하거나 매각하지 않기로 하는 내용의 예탁계약을 체결한 후 그 예탁계약을 이행할 예정이므로 증권신고서 제출 대상에서 면제됩니다.","{""adt_a_atn"": ""참석"", ""aprskh_ctref"": ""-"", ""aprskh_plnprc"": ""-"", ""aprskh_pym_plpd_mth"": ""-"", ""bddd"": ""2026년 04월 15일"", ""bdlst_atn"": ""아니오"", ""corp_cls"": ""K"", ""corp_code"": ""01423916"", ""corp_name"": ""온코크로스"", ""eadtat_intn"": ""신우회계법인"", ""eadtat_op"": ""적정"", ""ex_sm_r"": ""본 건 합병에 따른 쳥약의 권유자가 50인 미만에 해당하며, 증권의 발행 및 공시 등에 관한 규정 제2-2조 제2항 제1호에 의거 합병신주는 발행 후 지체없이 한국예탁결제원에 1년 이상의 기간동안 보호예수 예탁하여 해당증권을 인출하거나 매각하지 않기로 하는 내용의 예탁계약을 체결한 후 그 예탁계약을 이행할 예정이므로 증권신고서 제출 대상에서 면제됩니다."", ""exevl_atn"": ""예"", ""exevl_bs_rs"": ""자본시장과 금융투자업에 관한 법률 시행령 제176조의5에 따라, 주권상장법인이 비상장법인과 합병하는 경우에는 동 시행령 제176조의5 제1항 제2호에 따라 산정된 합병가액을 적용해야 합니다. 이에 따라 당사는 합병가액의 적정성을 확보하기 위해 외부 평가기관으로부터 평가를 받았습니다."", ""exevl_intn"": ""이촌회계법인"", ""exevl_op"": ""이촌회계법인(이하 \""본 평가인\"")은 코스닥시장 주권상장법인인 주식회사 온코크로스(이하 \""합병법인\"")와 주권비상장법인인 주식회사 온코마스터(이하 \""피합병법인\"")간 합병비율의 적정성을 검토하였습니다.\n\n본 평가인은 합병당사회사가 제시한 합병비율이 자본시장과 금융투자업에 관한 법률 시행령 제176조의5, 그리고 증권 발행 및 공시 등에 관한 규정 제5-13조 및 동 규정 시행세칙 제4조 내지 제8조에서 규정하고 있는 합병가액 산정방법에 따라 산정되었는지에 대하여 검토하였습니다.\n\n본 평가인은 본 검토업무를 수행함에 있어 합병법인의 2025년 12월 31일로 종료하는 회계연도의 한국채택국제회계기준(K-IFRS)에 따라 작성된 별도재무제표 및 주가자료, 피합병법인의 2025년 12월 31일로 종료하는 회계연도의 일반기업회계기준(K-GAAP)에 의하여 작성된 재무상태표를 한국채택국제회계기준(K-IFRS)으로 전환한 재무제표 및 2026년 1월에서 2030년 12월까지 5년의 사업계획을 기초로 하여 자본시장과 금융투자업에 관한 법률 시행령 제176조의5, 그리고 증권의 발행 및 공시 등에 관한 규정 제5-13조 및 동 규정 시행세칙 제4조 내지 제8조에서 규정하고 있는 합병가액 산정방법에 따라 합병비율을 검토하였습니다.\n\n본 평가인은 검토를 수행함에 있어 금융감독원이 제정한 \""외부평가업무 가이드라인(2009.6)\""과 한국공인회계사회가 제정한 \""자본시장법에 따른 외부평가업무 수행기준(2024.11)\""을 준수하였습니다. 또한, 본 평가인은 이촌회계법인의 \""자본시장법에 따른 외부평가업무 품질관리규정\""을 준수하였으며, 공인회계사윤리기준의 공정 강령 요구 사항을 포함한 관련 윤리적 요구사항을 준수하였습니다.\n\n본 평가인의 평가 결과 합병법인이 피합병법인을 합병함에 있어서 합병비율의 기준이 되는 주당평가액은 합병법인 7,706원(액면가액 500원), 피합병법인 35,793원 ~ 45,675원(액면가액 500원)의 범위로 평가되었으며, 이에 따른 합병비율은 1:4.6448222~ 1:5.9271996으로 평가되었습니다. 합병당사회사간 합병비율 1:5.2100960은 동 합병비율 범위내에 있으며, 따라서 합병당사회사간 합의한 합병비율 1:5.2100960은 적정한 것으로 판단됩니다.\n\n본 평가인의 검토결과 이러한 합병비율은 중요성의 관점에서 자본시장과 금융투자업에 관한 법률 시행령 제176조의5, 증권의 발행 및 공시 등에 관한 규정 제5-13조 및 동 규정 시행세칙 제4조 내지 제8조에서 규정하고 있는 합병가액 산정방법에 위배되\n어 산정되었다는 점이 발견되지 아니하였습니다."", ""exevl_pd"": ""2026년 03월 25일 ~ 2026년 04월 14일"", ""ffdtl_cpt"": ""-"", ""ffdtl_std"": ""-"", ""ffdtl_tast"": ""-"", ""ffdtl_tdbt"": ""-"", ""ffdtl_teqt"": ""-"", ""mg_mth"": ""(주)온코크로스가 (주)온코마스터를 흡수합병\n- 합병회사(존속회사) : (주)온코크로스(코스닥 상장법인)\n- 피합병회사(소멸회사) : (주)온코마스터(주권 비상장법인)"", ""mg_pp"": ""암 분야에 특화되어 항암제의 최적 적응증 및 바이오마커 발굴 AI 플랫폼인 ONCO-RAPTOR AI 고도화 및 암의 조기 진단 및 발생부위 진단을 보조하는 ONCOfind 개발 촉진을 위한 임상정보 코호트 데이터 취득"", ""mg_rt"": ""(주)온코크로스 : (주)온코마스터 = 1 : 5.2100960 "", ""mg_rt_bs"": ""1) (주)온코크로스(합병법인)의 합병가액 산정\n\n주권상장법인의 합병가액은 자본시장과 금융투자업에 관한 법률 시행령 제176조의5 제1항 제2호 가목에 따라, 기준시가를 적용하되 기준시가가 자산가치보다 낮은 경우에는 자산가치로 할 수 있도록 되어 있습니다.\n\n합병법인의 기준시가는「자본시장과 금융투자업에 관한 법률 시행령」 제176조의5  제1항 제1호에 따라 합병을 위한 이사회 결의일(\n2026년 4월 15일)과 합병계약 체결 예정일(\n2026년 4월 17일) 중 앞서는 날의 전일(\n2026년 4월 14일)을 기산일로 한 최 근 1개월간의 거래량 가중산술평균종가, 최근 1주일간의 거래량 가중산술평균종가, 최근일의 종가를 산술평균한 가액으로 산정하였습니다. 한편, 「자본시장과 금융투자업에 관한 법률 시행령」제176조의5 제1항 제1호에 따르면 상술한 방법으로 산출 된 가액을 기준으로 100분의 30(계열회사 간 주식교환의 경우에는 100분의 10)의 범위에서 할인 또는 할증한 가액을 기준주가로 적용할 수 있도록 규정되어 있으나 본 평가에서는 적용하지 아니하였습니다.\n\n가. (주)온코크로스의 기준시가\n①1개월 가중평균 주가(\n2026년 03월 16일~ 2026년 04월 14일) : \n7,563원\n② 1주일 가중평균 주가(\n2026년 04월 8일~ 2026년 04월 14일) : \n7,804원\n③ 최근일 주가(\n2026년 04월 14일) : \n7,750원  \n④ 기준시가 : \n7,706원\n\n나. (주)온코크로스의 자산가치\n\n① 최근사업연도 말 자본총계 : 13,021,687,341원\n② 조정항목 (가산항목-차감항목) : 1,379,455,760원\n③ 조정된 순자산가액 (①+②) : 14,401,143,101원\n④ 발행주식 총 수 : 12,382,557주 (보고서 제출일 현재 발행주식 총수인 12,195,957주와 분석기준일까지 전환주식 등 향후 자본금을 증가시킬 수 있는 증권의 권리행사 가능성을 반영한 186,600주의 합)\n⑤ 1주당 자산가치 (③÷④) : 1,163원\n\n다. (주)온코크로스 합병가액\n① 기준시가: \n7,706원\n② 자산가치: \n1,163원\n③ 합병가액[Max(①,②)]: \n7,706원\n\n\n2) (주)온코마스터(피합병법인)의 합병가액 산정\n\n\n「자본시장과 금융투자업에 관한 법률 시행령」 제176조의5에 의하여 피합병법인의  합병가액은 자산가치와 수익가치를 각각 1과 1.5의 비율로 가중산술평균한 가액(이 하 \""본질가치\"")으로 산정하였으며, 상대가치는 비교 목적으로 분석하였으나 3개 이상 의 유사회사가 존재하지 아니하여 가치를 산정하지 아니하였습니다.\n\n\n- (주)온코마스터 보통주\n가. 본질가치[(A X 1 + B X 1.5)/2.5] : 40,149원\n  A. 자산가치 : 4,579 원\n  B. 수익가치 : 63,863 원\n나. 합병가액 : 40,149 원\n다. 상대가치 : -\n\n3) 산출결과\n(주)온코크로스와 (주)온코마스터 간 합병비율은 \n1 : 5.2100960 으로 산정되었으며, 합병비율의 기준이 되는 주당 평가액은 각각 \n7,706원(주당액면가액 500원)과 \n40,149원(주당 액면가액 500원)으로 산정되었습니다."", ""mg_stn"": ""소규모합병"", ""mgnstk_cstk_cnt"": ""-"", ""mgnstk_ostk_cnt"": ""850,397"", ""mgptncmp_cmpnm"": ""(주)온코마스터 (oncoMASTER Inc.)"", ""mgptncmp_mbsn"": ""암 환자 코호트 데이터 기반 정밀의료 플랫폼 사업"", ""mgptncmp_rl_cmpn"": ""-"", ""mgsc_aprskh_expd_bgd"": ""-"", ""mgsc_aprskh_expd_edd"": ""-"", ""mgsc_cdobprpd_bgd"": ""2026년 05월 18일"", ""mgsc_cdobprpd_edd"": ""2026년 06월 30일"", ""mgsc_ergmd"": ""2026년 07월 01일"", ""mgsc_gmtsck_prd"": ""-"", ""mgsc_mgctrd"": ""2026년 04월 17일"", ""mgsc_mgdt"": ""2026년 07월 01일"", ""mgsc_mgop_rcpd_bgd"": ""2026년 04월 30일"", ""mgsc_mgop_rcpd_edd"": ""2026년 05월 14일"", ""mgsc_mgrgsprd"": ""2026년 07월 01일"", ""mgsc_nstkdlprd"": ""-"", ""mgsc_nstklstprd"": ""2026년 07월 24일"", ""mgsc_osprpd_bgd"": ""-"", ""mgsc_osprpd_edd"": ""-"", ""mgsc_shclspd_bgd"": ""-"", ""mgsc_shclspd_edd"": ""-"", ""mgsc_shddstd"": ""2026년 04월 30일"", ""mgsc_trspprpd_bgd"": ""-"", ""mgsc_trspprpd_edd"": ""-"", ""nmgcmp_cmpnm"": ""-"", ""nmgcmp_mbsn"": ""-"", ""nmgcmp_nbsn_rsl"": ""-"", ""nmgcmp_rlst_atn"": ""해당사항없음"", ""od_a_at_b"": ""-"", ""od_a_at_t"": ""1"", ""otcpr_bdlst_sf_atn"": ""해당사항없음"", ""popt_ctr_atn"": ""아니오"", ""popt_ctr_cn"": ""-"", ""rbsnfdtl_cpt"": ""77,816,000"", ""rbsnfdtl_nic"": ""-1,103,073,468"", ""rbsnfdtl_sl"": ""87,825,955"", ""rbsnfdtl_tast"": ""1,996,397,524"", ""rbsnfdtl_tdbt"": ""1,239,764,016"", ""rbsnfdtl_teqt"": ""756,633,508"", ""rcept_no"": ""20260415000702"", ""rs_sm_atn"": ""아니오""}",2026-05-12T12:14:37
kosdaq_004,382480,01311310,지아이텍,mna,merger_decision,회사합병 결정,true,20250407004154,2025-04-07,20190101,20260512,https://dart.fss.or.kr/dsaf001/main.do?rcpNo=20250407004154,cmpMgDecsn.json,"bddd=2025년 04월 03일 | od_a_at_t=3 | adt_a_atn=참석 | rs_sm_atn=아니오 | ex_sm_r=본건 합병은 합병신주를 발행하지 않는 무증자합병 방식으로,증권신고서 제출이 필요한 증권의 모집이나 매출이 이루어지지 않습니다.","{""adt_a_atn"": ""참석"", ""aprskh_ctref"": ""-"", ""aprskh_plnprc"": ""-"", ""aprskh_pym_plpd_mth"": ""-"", ""bddd"": ""2025년 04월 03일"", ""bdlst_atn"": ""해당사항없음"", ""corp_cls"": ""K"", ""corp_code"": ""01311310"", ""corp_name"": ""지아이텍"", ""eadtat_intn"": ""-"", ""eadtat_op"": ""-"", ""ex_sm_r"": ""본건 합병은 합병신주를 발행하지 않는 무증자합병 방식으로,증권신고서 제출이 필요한 증권의 모집이나 매출이 이루어지지 않습니다."", ""exevl_atn"": ""미해당"", ""exevl_bs_rs"": ""「자본시장과 금융투자업에 관한 법률 시행령」제176조의5 제8항 제2호 나목에서는 다른 회사의 발행주식총수를 소유하고 있는 회사가 그 다른 회사를 합병하면서 신주를 발행하지 않는 경우에는 합병가액의 적정성에 대한 외부평가기관의 평가를 요구하지 않는 것으로 규정하고 있습니다. 본건 합병은 이에 해당하므로 위 규정에 따라 외부평가기관의 평가를 거치지 아니하였습니다."", ""exevl_intn"": ""-"", ""exevl_pd"": ""-"", ""ffdtl_cpt"": ""-"", ""ffdtl_std"": ""-"", ""ffdtl_tast"": ""-"", ""ffdtl_tdbt"": ""-"", ""ffdtl_teqt"": ""-"", ""mg_mth"": ""(주)지아이텍이 (주)엠브이텍을 흡수합병\n- 존속회사 : (주)지아이텍\n- 소멸회사 : (주)엠브이텍  "", ""mg_pp"": ""기술력 강화, 시장확대, 비용 절감 및 운영 효율화"", ""mg_rt"": ""(주)지아이텍 : (주)엠브이텍 = 1.0000000 : 0.0000000"", ""mg_rt_bs"": ""존속회사인 ㈜지아이텍은 소멸회사인 ㈜엠브이텍의 주식 100%를 소유하고 있으며, 합병 시 존속회사는 소멸회사의 주식에 대해 신주를 발행하지 않으므로 합병비율을1.0000000 : 0.0000000으로 산출하였습니다. "", ""mg_stn"": ""소규모합병"", ""mgnstk_cstk_cnt"": ""-"", ""mgnstk_ostk_cnt"": ""-"", ""mgptncmp_cmpnm"": ""(주)엠브이텍"", ""mgptncmp_mbsn"": ""기기용 자동측정 및 제어장치 제조업"", ""mgptncmp_rl_cmpn"": ""자회사"", ""mgsc_aprskh_expd_bgd"": ""-"", ""mgsc_aprskh_expd_edd"": ""-"", ""mgsc_cdobprpd_bgd"": ""2025년 05월 08일"", ""mgsc_cdobprpd_edd"": ""2025년 06월 29일"", ""mgsc_ergmd"": ""2025년 07월 01일"", ""mgsc_gmtsck_prd"": ""-"", ""mgsc_mgctrd"": ""2025년 04월 07일"", ""mgsc_mgdt"": ""2025년 07월 01일"", ""mgsc_mgop_rcpd_bgd"": ""2025년 04월 18일"", ""mgsc_mgop_rcpd_edd"": ""2025년 05월 02일"", ""mgsc_mgrgsprd"": ""2025년 07월 07일"", ""mgsc_nstkdlprd"": ""-"", ""mgsc_nstklstprd"": ""-"", ""mgsc_osprpd_bgd"": ""-"", ""mgsc_osprpd_edd"": ""-"", ""mgsc_shclspd_bgd"": ""-"", ""mgsc_shclspd_edd"": ""-"", ""mgsc_shddstd"": ""2025년 04월 18일"", ""mgsc_trspprpd_bgd"": ""-"", ""mgsc_trspprpd_edd"": ""-"", ""nmgcmp_cmpnm"": ""-"", ""nmgcmp_mbsn"": ""-"", ""nmgcmp_nbsn_rsl"": ""-"", ""nmgcmp_rlst_atn"": ""해당사항없음"", ""od_a_at_b"": ""-"", ""od_a_at_t"": ""3"", ""otcpr_bdlst_sf_atn"": ""해당사항없음"", ""popt_ctr_atn"": ""아니오"", ""popt_ctr_cn"": ""-"", ""rbsnfdtl_cpt"": ""100,000,000"", ""rbsnfdtl_nic"": ""-1,199,850,857"", ""rbsnfdtl_sl"": ""5,173,247,082"", ""rbsnfdtl_tast"": ""14,276,584,346"", ""rbsnfdtl_tdbt"": ""11,672,601,114"", ""rbsnfdtl_teqt"": ""2,603,983,232"", ""rcept_no"": ""20250407004154"", ""rs_sm_atn"": ""아니오""}",2026-05-12T12:14:37
kosdaq_004,382900,01435489,범한퓨얼셀,mna,tangible_asset_acquisition,유형자산 양수 결정,true,20240229002074,2024-02-29,20190101,20260512,https://dart.fss.or.kr/dsaf001/main.do?rcpNo=20240229002074,tgastInhDecsn.json,bddd=2024년 02월 23일 | od_a_at_t=3 | ftc_stt_atn=미해당 | inh_pp=해양 및 육상 수소모빌리티 시장 진출 계획에 따른 양수 | inh_af=매출 확대 및 임대수익 창출,"{""adt_a_atn"": ""-"", ""aprskh_ctref"": ""-"", ""aprskh_ex_pc_mth_pd_pl"": ""-"", ""aprskh_exrq"": ""-"", ""aprskh_lmt"": ""-"", ""aprskh_plnprc"": ""-"", ""aprskh_pym_plpd_mth"": ""-"", ""ast_nm"": ""경남 창원시 성산구 대원동 82의\n공장부지(129,890.7㎡),\n건축물(48,302.19㎡) 등 일체"", ""ast_sen"": ""토지 및 건물"", ""bddd"": ""2024년 02월 23일"", ""corp_cls"": ""K"", ""corp_code"": ""01435489"", ""corp_name"": ""범한퓨얼셀"", ""dl_pym"": ""1. 지급형태 : 현금\n2. 지급시기 및 조건\n - 계약금 : 11,001,743,200원(2024.02.23)\n - 중도금 : 16,502,614,800원(2024.02.29)\n - 잔   금 : 82,513,074,000원(2024.02.29)\n3. 자금조달 방법 : 자기자금 및 차입"", ""dlptn_cmpnm"": ""두산건설㈜\n(Doosan Engineering &\nConstruction Co.,Ltd.)"", ""dlptn_cpt"": ""261,885,121,000"", ""dlptn_hoadd"": ""서울특별시 강남구 언주로 726(논현동)"", ""dlptn_mbsn"": ""아파트 건설업"", ""dlptn_rl_cmpn"": ""-"", ""exevl_atn"": ""예"", ""exevl_bs_rs"": ""1. 근거 : 자본시장과 금융투자업에 관한 법률 제161조 제1항 제7호 및 동법 시행령 제171조 제2항 제5호에 따른 적정성 평가\n\n2. 사유 : 회사가 양수하기로 의사결정한 자산양수가액의 적정성 여부를 판단하기 위한 참고자료 제공"", ""exevl_intn"": ""신정회계법인"", ""exevl_op"": ""적정"", ""exevl_pd"": ""2024년 02월 21일 ~ 2024년 02월 23일"", ""ftc_stt_atn"": ""미해당"", ""gmtsck_prd"": ""-"", ""gmtsck_spd_atn"": ""미해당"", ""inh_af"": ""매출 확대 및 임대수익 창출"", ""inh_pp"": ""해양 및 육상 수소모빌리티 시장\n진출 계획에 따른 양수"", ""inh_prd_ctr_cnsd"": ""2024년 02월 23일"", ""inh_prd_inh_std"": ""2024년 02월 29일"", ""inh_prd_rgs_prd"": ""2024년 02월 29일"", ""inhdtl_inhprc"": ""110,017,432,000"", ""inhdtl_tast"": ""129,702,045,663"", ""inhdtl_tast_vs"": ""84.82"", ""od_a_at_b"": ""-"", ""od_a_at_t"": ""3"", ""popt_ctr_atn"": ""아니오"", ""popt_ctr_cn"": ""-"", ""rcept_no"": ""20240229002074""}",2026-05-12T12:14:37
