batch_id,stock_code,corp_code,company_name,event_category,event_code,event_name,rcept_date,report_url,source_api,summary,details_json
kosdaq_004,382480,01311310,지아이텍,mna,merger_decision,회사합병 결정,2025-04-07,https://dart.fss.or.kr/dsaf001/main.do?rcpNo=20250407004154,cmpMgDecsn.json,"bddd=2025년 04월 03일 | mg_mth=(주)지아이텍이 (주)엠브이텍을 흡수합병 - 존속회사 : (주)지아이텍 - 소멸회사 : (주)엠브이텍 | mg_pp=기술력 강화, 시장확대, 비용 절감 및 운영 효율화 | mg_rt=(주)지아이텍 : (주)엠브이텍 = 1.0000000 : 0.0000000 | mg_rt_bs=존속회사인 ㈜지아이텍은 소멸회사인 ㈜엠브이텍의 주식 100%를 소유하고 있으며, 합병 시 존속회사는 소멸회사의 주식에 대해 신주를 발행하지 않으므로 합병비율을1.0000000 : 0.0000000으로 산출하였습니다.","{""bddd"": ""2025년 04월 03일"", ""mg_mth"": ""(주)지아이텍이 (주)엠브이텍을 흡수합병 - 존속회사 : (주)지아이텍 - 소멸회사 : (주)엠브이텍"", ""mg_pp"": ""기술력 강화, 시장확대, 비용 절감 및 운영 효율화"", ""mg_rt"": ""(주)지아이텍 : (주)엠브이텍 = 1.0000000 : 0.0000000"", ""mg_rt_bs"": ""존속회사인 ㈜지아이텍은 소멸회사인 ㈜엠브이텍의 주식 100%를 소유하고 있으며, 합병 시 존속회사는 소멸회사의 주식에 대해 신주를 발행하지 않으므로 합병비율을1.0000000 : 0.0000000으로 산출하였습니다."", ""mg_stn"": ""소규모합병"", ""mgptncmp_cmpnm"": ""(주)엠브이텍"", ""mgptncmp_mbsn"": ""기기용 자동측정 및 제어장치 제조업"", ""mgptncmp_rl_cmpn"": ""자회사"", ""mgsc_mgdt"": ""2025년 07월 01일"", ""rbsnfdtl_sl"": ""5,173,247,082"", ""rbsnfdtl_tast"": ""14,276,584,346""}"
kosdaq_004,382900,01435489,범한퓨얼셀,mna,tangible_asset_acquisition,유형자산 양수 결정,2024-02-29,https://dart.fss.or.kr/dsaf001/main.do?rcpNo=20240229002074,tgastInhDecsn.json,"ast_nm=경남 창원시 성산구 대원동 82의 공장부지(129,890.7㎡), 건축물(48,302.19㎡) 등 일체 | ast_sen=토지 및 건물 | bddd=2024년 02월 23일 | dl_pym=1. 지급형태 : 현금 2. 지급시기 및 조건 - 계약금 : 11,001,743,200원(2024.02.23) - 중도금 : 16,502,614,800원(2024.02.29) - 잔 금 : 82,513,074,000원(2024.02.29) 3. 자금조달 방법 : 자기자금 및 차입 | dlptn_cmpnm=두산건설㈜ (Doosan Engineering & Construction Co.,Ltd.)","{""ast_nm"": ""경남 창원시 성산구 대원동 82의 공장부지(129,890.7㎡), 건축물(48,302.19㎡) 등 일체"", ""ast_sen"": ""토지 및 건물"", ""bddd"": ""2024년 02월 23일"", ""dl_pym"": ""1. 지급형태 : 현금 2. 지급시기 및 조건 - 계약금 : 11,001,743,200원(2024.02.23) - 중도금 : 16,502,614,800원(2024.02.29) - 잔 금 : 82,513,074,000원(2024.02.29) 3. 자금조달 방법 : 자기자금 및 차입"", ""dlptn_cmpnm"": ""두산건설㈜ (Doosan Engineering & Construction Co.,Ltd.)"", ""dlptn_mbsn"": ""아파트 건설업"", ""exevl_op"": ""적정"", ""inh_af"": ""매출 확대 및 임대수익 창출"", ""inh_pp"": ""해양 및 육상 수소모빌리티 시장 진출 계획에 따른 양수"", ""inh_prd_ctr_cnsd"": ""2024년 02월 23일"", ""inhdtl_inhprc"": ""110,017,432,000"", ""inhdtl_tast"": ""129,702,045,663"", ""inhdtl_tast_vs"": ""84.82""}"
kosdaq_004,388050,01462605,지투파워,mna,tangible_asset_acquisition,유형자산 양수 결정,2025-12-01,https://dart.fss.or.kr/dsaf001/main.do?rcpNo=20251201000718,tgastInhDecsn.json,"ast_nm=제2용인테크노밸리 일반산업단지 산업4-1, 산업4-2-1 산업용지 (일반공업지역) [토지 : 6,613㎡] (경기도 용인시 처인구 이동읍 덕성리, 묵리 일원) | ast_sen=토지 및 건물 | bddd=2023년 12월 27일 | dl_pym=1. 지급형태 : 현금지급 2. 지급시기 및 조건 : 10,202,205,000원(총액) - 계약금 1차 : 204,044,100원 (계약체결일 납부)/비율 2% - 계약금 2차 : 816,176,400원 (2024.01.26. 납부)/비율 8% - 중도금 1차 : 1,428,308,700원 (2024.04.26. 납부)/비율14% - 중도금 2차 : 1,428,308,700원 (2024.08.26. 납부)/비율14% - 중도금 3차 : 1,428,308,700원 (2024.12.26. 납부)/비율14% - 중도금 4차 : 1,428,308,700원 (2025.04.25. 납부)/비율14% - 중도금 5차 : 1,428,308,700원 (2025.08.26. 납부)/비율14% - 잔 금 : 2,040,441,000원 (2026.10.31. 납부 예정)/비율20% *토지사용 가능시기(2026.10.31 이후) 또는 소유권 이전 가능일 중 빠른날 3. 자금조달 방법 - 자기자금 및 외부자금조달 | dlptn_cmpnm=㈜제이용인테크노밸리","{""ast_nm"": ""제2용인테크노밸리 일반산업단지 산업4-1, 산업4-2-1 산업용지 (일반공업지역) [토지 : 6,613㎡] (경기도 용인시 처인구 이동읍 덕성리, 묵리 일원)"", ""ast_sen"": ""토지 및 건물"", ""bddd"": ""2023년 12월 27일"", ""dl_pym"": ""1. 지급형태 : 현금지급 2. 지급시기 및 조건 : 10,202,205,000원(총액) - 계약금 1차 : 204,044,100원 (계약체결일 납부)/비율 2% - 계약금 2차 : 816,176,400원 (2024.01.26. 납부)/비율 8% - 중도금 1차 : 1,428,308,700원 (2024.04.26. 납부)/비율14% - 중도금 2차 : 1,428,308,700원 (2024.08.26. 납부)/비율14% - 중도금 3차 : 1,428,308,700원 (2024.12.26. 납부)/비율14% - 중도금 4차 : 1,428,308,700원 (2025.04.25. 납부)/비율14% - 중도금 5차 : 1,428,308,700원 (2025.08.26. 납부)/비율14% - 잔 금 : 2,040,441,000원 (2026.10.31. 납부 예정)/비율20% *토지사용 가능시기(2026.10.31 이후) 또는 소유권 이전 가능일 중 빠른날 3. 자금조달 방법 - 자기자금 및 외부자금조달"", ""dlptn_cmpnm"": ""㈜제이용인테크노밸리"", ""dlptn_mbsn"": ""부동산 개발 및 분양"", ""exevl_op"": ""적정"", ""inh_af"": ""생산능력 확대를 통한 중장기 매출증대 및 성장 발판 마련"", ""inh_pp"": ""생산시설 확충을 위한 공장 신축 부지 확보"", ""inh_prd_ctr_cnsd"": ""2023년 12월 27일"", ""inhdtl_inhprc"": ""10,202,205,000"", ""inhdtl_tast"": ""44,683,048,330"", ""inhdtl_tast_vs"": ""22.83""}"
kosdaq_004,388720,01152586,유일로보틱스,mna,tangible_asset_acquisition,유형자산 양수 결정,2024-01-24,https://dart.fss.or.kr/dsaf001/main.do?rcpNo=20240124000452,tgastInhDecsn.json,"ast_nm=(토지) 인천광역시 서구 청라동 200-4 토지 26,045.4㎡ | ast_sen=토지 및 건물 | bddd=2022년 10월 17일 | dl_pym=계약금(10%) : 2022년 10월 17일(계약체결일) 중도금(75%) : 계약일로부터 6개월단위 매매대금의 15%씩 5회 분납 잔금(15%) : 2025년 10월 17일 (잔금 기한) ※ 중도금 및 잔금은 상기 방식 및 일시납 중 선택 가능 | dlptn_cmpnm=LH(한국토지주택공사)","{""ast_nm"": ""(토지) 인천광역시 서구 청라동 200-4 토지 26,045.4㎡"", ""ast_sen"": ""토지 및 건물"", ""bddd"": ""2022년 10월 17일"", ""dl_pym"": ""계약금(10%) : 2022년 10월 17일(계약체결일) 중도금(75%) : 계약일로부터 6개월단위 매매대금의 15%씩 5회 분납 잔금(15%) : 2025년 10월 17일 (잔금 기한) ※ 중도금 및 잔금은 상기 방식 및 일시납 중 선택 가능"", ""dlptn_cmpnm"": ""LH(한국토지주택공사)"", ""dlptn_mbsn"": ""토지 취득, 관리, 택지개방, 공급 등"", ""exevl_op"": ""적정"", ""inh_af"": ""매출 및 수익성 증대"", ""inh_pp"": ""공장신축을 위한 토지 매입"", ""inh_prd_ctr_cnsd"": ""2022년 10월 17일"", ""inhdtl_inhprc"": ""25,997,606,000"", ""inhdtl_tast"": ""38,055,319,460"", ""inhdtl_tast_vs"": ""68.32""}"
kosdaq_004,388790,01569102,라이콤,mna,merger_decision,회사합병 결정,2022-11-07,https://dart.fss.or.kr/dsaf001/main.do?rcpNo=20221107000089,cmpMgDecsn.json,"aprskh_plnprc=2,028 | bddd=2022년 06월 23일 | exevl_op=합병법인이 피합병법인을 합병함에 있어서 합병비율의 기준이 되는 주당 평가액은 합병법인인 아이비케이에스제16호기업인수목적 주식회사가 2,000원(주당 액면가액 100원)으로, 피합병법인인 주식회사 라이콤 19,054원(주당 액면가액 500원)으로산정되었습니다. 따라서 합병당사회사가 합의한 합병비율(1 : 9.5270000)은 적정한 것으로 판단됩니다. 본 평가인의 검토결과 이러한 합병비율은 중요성의 관점에서 자본시장과금융투자업에관한법률시행령 제176조의5, 그리고 증권의발행및공시등에관한규정 제5-13조 및동 규정 시행세칙 제4조 내지 제8조에서 규정하고 있는 합병가액 산정방법에 위배되어 산정되었다는 점이 발견되지 아니하였습니다. | mg_mth=코스닥시장 상장법인 아이비케이에스제16호기업인수목적(주)가 비상장사인 (주)라이콤을 흡수합병함 | mg_pp=(1) 합병 시 유입 자금을 통한 재무적 안정성 제고 (2) 코스닥 시장 상장을 통한 자금 조달능력강화(3) 기업 신용도 및 이미지 제고를 통한 신규 사업 확대 및 매출 증대(4) 사업의 확장 및 경쟁력 제고(5) 언론 노출 증가에 따른 회사 홍보 및 우수 인력 확보(6) 임직원 자긍심 고취(7) 기업가치의 공정한 평가 및 홍보 효과와 공신력 제고","{""aprskh_plnprc"": ""2,028"", ""bddd"": ""2022년 06월 23일"", ""exevl_op"": ""합병법인이 피합병법인을 합병함에 있어서 합병비율의 기준이 되는 주당 평가액은 합병법인인 아이비케이에스제16호기업인수목적 주식회사가 2,000원(주당 액면가액 100원)으로, 피합병법인인 주식회사 라이콤 19,054원(주당 액면가액 500원)으로산정되었습니다. 따라서 합병당사회사가 합의한 합병비율(1 : 9.5270000)은 적정한 것으로 판단됩니다. 본 평가인의 검토결과 이러한 합병비율은 중요성의 관점에서 자본시장과금융투자업에관한법률시행령 제176조의5, 그리고 증권의발행및공시등에관한규정 제5-13조 및동 규정 시행세칙 제4조 내지 제8조에서 규정하고 있는 합병가액 산정방법에 위배되어 산정되었다는 점이 발견되지 아니하였습니다."", ""mg_mth"": ""코스닥시장 상장법인 아이비케이에스제16호기업인수목적(주)가 비상장사인 (주)라이콤을 흡수합병함"", ""mg_pp"": ""(1) 합병 시 유입 자금을 통한 재무적 안정성 제고 (2) 코스닥 시장 상장을 통한 자금 조달능력강화(3) 기업 신용도 및 이미지 제고를 통한 신규 사업 확대 및 매출 증대(4) 사업의 확장 및 경쟁력 제고(5) 언론 노출 증가에 따른 회사 홍보 및 우수 인력 확보(6) 임직원 자긍심 고취(7) 기업가치의 공정한 평가 및 홍보 효과와 공신력 제고"", ""mg_rt"": ""아이비케이에스제16호기업인수목적(주) : ㈜라이콤= 1 : 9.5270000"", ""mg_rt_bs"": ""1. 합병법인의 합병가액 산정 주권상장법인의 합병가액은 원칙적으로 기준시가를 적용하되, 기준시가가 자산가치보다 낮은 경우에는 자산가치로 할 수 있습니다. 자본시장과금융투자업에관한법률시행령 제176조의5 제1항 제1호에 의하면, 상장법인인 합병법인의 합병가액은 합병법인의 기준시가를 100분의 30의 범위에서 할인 또는 할증한 가액으로 하도록 규정하고 있습니다. 본 평가에서는 자산가치보다 기준주가에 할인율을 반영한 평가가액이 높기에 기준시가에 할인율을 반영한 평가가액를 합병가액으로 산정하였습니다. 기준시가 : 2,314원 할인율 : (-)13.57% 기준시가에 할인율을 적용한 평가가액(A) : 2,000원 1주당 자산가치(B) : 1,917원 합병가액(MAX[A,B]) : 2,000원 - 합병법인의 기준주가 산정 합병법인의 기준시가는 자본시장과금융투자업에관한법률시행령 제176조의5 제1항 제1호에 따라 합병을 위한 이사회 결의일(2022년 06월 23일)과 합병계약을 체결한날(2022년 06월 23일) 중 앞서는 날의 전일(2022년 06월 22일)을 기산일로 한 최근 1개월간의 거래량 가중산술평균종가, 최근 1주일간의 거래량 가중산술평균종가, 최근일의종가를 산술평균한 가액으로 산정하였습니다. A . 1개월 가중산술평균 종가(2022년 05월 23일 ~ 2022년 06월 22일) : 2,372원 B. 1주일 가중산술평균 종가(2022년 06월 16일 ~ 2022년 06월 22일) : 2,315원 C. 최근일 종가(2022년 06월 22일) : 2,255원 D. 산술평균 주가([A+B+C]÷3) : 2,314원 E. 할인율 : 13.57% F. 기준주가에 할인율을 반영한 평가가액(D×(1-E)) : 2,000원 2. 피합병법인의 합병가액 산정 자본시장과금융투자업에관한법률시행령 제176조의5 제2항 2호 나목 및 증권의발행및공시등에관한규정시행세칙 제4조의 규정에 의거하여 주권비상장법인인 피합병법인의 합병가액은 본질가치(자산가치와 수익가치를 각각 1과 1.5의 비율로 가중산술평균한 가액)로 평가하였습니다. 상대가치는 비교목적으로 분석하였으나 3개 이상의유사회사가 존재하지 아니하여 가치를 산정하지 아니하였습니다. 가. 본질가치 : 19,054원((Ax1+Bx1.5)÷2.5) A. 자산가치 : 5,144원(1주당 순자산가액) B. 수익가치 : 28,328원 나. 상대가치 : 해당사항 없음 다. 합병가액 : 19,054원 (상대가치가 없을 경우 본질가치) 3. 합병가격 산정 결과 합병법인이 피합병법인을 합병함에 있어서 합병비율의 기준이 되는 합병당사회사의 주당 평가액은 합병법인과 피합병법인이 각각 2,000원(100원)과 19,054원(액면가액 500원)으로 추정되었으며, 합병당사회사가 협의한 합병비율 1: 9.5270000으로 산정되었습니다."", ""mg_stn"": ""해당사항없음"", ""mgptncmp_cmpnm"": ""(주)라이콤"", ""mgptncmp_mbsn"": ""광증폭기, 광송수신기 및 광증폭기 제조업"", ""mgsc_mgdt"": ""2023년 01월 26일"", ""rbsnfdtl_sl"": ""28,033,010,712"", ""rbsnfdtl_tast"": ""21,984,034,633""}"
kosdaq_004,391710,01573284,코닉오토메이션,mna,merger_decision,회사합병 결정,2022-04-27,https://dart.fss.or.kr/dsaf001/main.do?rcpNo=20220427000223,cmpMgDecsn.json,"aprskh_plnprc=2,011 | bddd=2021년 12월 15일 | exevl_op=합병법인이 피합병법인을 합병함에 있어서 합병비율의 기준이 되는 양 합병당사 회사의 주당 평가액은 합병법인과 피합병법인이 각각 2,000원(액면가액 100원)과 9,226원(액면가액 500원)으로 추정되었으며, 이에 합병비율 1 : 4.6130000은 적정한 것으로 판단됩니다. 본 평가인의 검토 결과 이러한 합병비율은 중요성의 관점에서 자본시장과금융투자업에관한법률 시행령 제176조의5, 그리고 증권의발행및공시등에관한규정 제5-13조 및 동 규정 시행세칙 제4조 내지 제8조에서 규정하고 있는 합병가액 산정방법에 위배되어 산정되었다는 점이 발견되지 아니하였습니다. | mg_mth=코스닥시장 상장법인인 엔에이치기업인수목적21호(주)가 주권비상장법인인 코닉오토메이션(주)를 흡수합병함 | mg_pp=(1) 합병상장을 통한 경영투명성 확보(2) 대외 인지도 향상을 통한 기업경쟁력 강화(3) 주주 중심 경영을 통한 공정한 기업가치 평가 (4) 상장을 통한 회사의 사회적 책임 구현 및 주주의 권익 보호(5) 주식회사로서의 재무건전성 확보를 통한 대외 신인도 향상(6) 합리적인 기업 경영체계 강화를 통한 효율적인 경영 실현(7) 자금조달 능력 확대를 통한 지속 성장 가능한 성장동력 확보(8) 홍보효과 및 기업평가를 통한 국내외 관련업체와의 제휴 (9) 임직원 자긍심 고취 및 사기 진작","{""aprskh_plnprc"": ""2,011"", ""bddd"": ""2021년 12월 15일"", ""exevl_op"": ""합병법인이 피합병법인을 합병함에 있어서 합병비율의 기준이 되는 양 합병당사 회사의 주당 평가액은 합병법인과 피합병법인이 각각 2,000원(액면가액 100원)과 9,226원(액면가액 500원)으로 추정되었으며, 이에 합병비율 1 : 4.6130000은 적정한 것으로 판단됩니다. 본 평가인의 검토 결과 이러한 합병비율은 중요성의 관점에서 자본시장과금융투자업에관한법률 시행령 제176조의5, 그리고 증권의발행및공시등에관한규정 제5-13조 및 동 규정 시행세칙 제4조 내지 제8조에서 규정하고 있는 합병가액 산정방법에 위배되어 산정되었다는 점이 발견되지 아니하였습니다."", ""mg_mth"": ""코스닥시장 상장법인인 엔에이치기업인수목적21호(주)가 주권비상장법인인 코닉오토메이션(주)를 흡수합병함"", ""mg_pp"": ""(1) 합병상장을 통한 경영투명성 확보(2) 대외 인지도 향상을 통한 기업경쟁력 강화(3) 주주 중심 경영을 통한 공정한 기업가치 평가 (4) 상장을 통한 회사의 사회적 책임 구현 및 주주의 권익 보호(5) 주식회사로서의 재무건전성 확보를 통한 대외 신인도 향상(6) 합리적인 기업 경영체계 강화를 통한 효율적인 경영 실현(7) 자금조달 능력 확대를 통한 지속 성장 가능한 성장동력 확보(8) 홍보효과 및 기업평가를 통한 국내외 관련업체와의 제휴 (9) 임직원 자긍심 고취 및 사기 진작"", ""mg_rt"": ""엔에이치기업인수목적21호(주) : 코닉오토메이션(주) = 1 : 4.6130000"", ""mg_rt_bs"": ""1. 합병법인의 합병가액 산정 주권상장법인의 합병가액은 원칙적으로 기준주가를 적용하되, 기준주가가 자산가치보다 낮은 경우에는 자산가치로 할 수 있습니다. 자본시장과 금융투자업에 관한 법률시행령 제176조의5 제1항 제1호에 의하면, 상장법인인 합병법인의 합병가액은 합병법인의 기준시가를 100분의 30의 범위에서 할인 또는 할증한 가액으로 하도록 규정하고 있습니다. 본 건 합병법인의 합병가액은 자산가치보다 기준주가가 높기 때문에 본 평가에서는 기준주가에 할인율(11.1111%)을 반영한 평가가액을 합병가액으로 산정하였습니다. A. 기준주가에 할인율을 반영한 평가가액 : 2,000원 B. 자산가치 : 1,551원 C. 합병가액 (Max[A, B]) : 2,000원 (1) 합병법인의 기준주가 산정 합병법인의 기준주가는 자본시장과 금융투자업에 관한 법률 시행령 제176조의5제1항제1호에 따라 합병을 위한 이사회 결의일(2021년 12월 15일)과 합병계약을 체결한날(2021년 12월 15일) 중 앞서는 날의 전일(2021년 12월 14일)을 기산일로 한 최근1개월간의 거래량 가중산술평균종가, 최근1주일간의 거래량 가중산술평균종가, 최근일의종가를 산술평균한 가액을 기준으로 100분의 30의 범위에서 할인 또는 할증한 가액(본 합병에서는 11.1111% 할인한 가액)으로 산정하였습니다. A. 1개월 가중평균주가(2021.11.15~2021.12.14) : 2,168원 B. 1주일 가중평균 주가(2021.12.08~2021.12.14) : 2,261원 C. 최종일 주가(2021.12.14) : 2,320원 D. 산술평균주가([A+B+C]÷3) : 2,250원 E. 할인율 : 11.1111% F. 할인 후 산술평균주가(Dx[1-E]): 2,000원 (2) 합병법인의 자산가치 산정 합병법인의 1주당 자산가치는 증권의 발행 및 공시 등에 관한 규정 시행세칙 제5조에 따라 주요사항보고서를 제출하는 날이 속하는 사업연도의 직전 사업연도말의 감사받은 재무상태표상의 자본총계에서 일부 조정항목을 가감하여 산정된 순자산가액을 기준으로 산정하여야 하나, 합병법인은 2021년 06월 09일 설립된 점을 감안하여 2021년 06월 30일 기준의 검토받은 재무상태표상의 자본총계에서 일부 조정항목을 가감하여 산정된 순자산가액에 분석기준일 현재의 발행주식총수로 나누어 산정하였습니다. A. 조정된 순자산가액 : 13,572,052,277원 B. 발행주식수 : 8,750,000주 C. 1주당 주식가액: 1,551원 2. 피합병법인의 합병가액 산정 자본시장과 금융투자업에 관한 법률 시행령 제176조의5에 의하면, 비상장법인인 피합병법인의 합병가액은 본질가치(자산가치와 수익가치를 각각 1과 1.5의 비율로 가중산술평균한가액)로 평가하되, 상대가치를 비교하여 공시하도록 규정하고 있습니다. 본 평가에 있어 합병가액의 산정은 자본시장과 금융투자업에 관한 법률 시행령 제176조의5 제1항 2호 나목 및 증권의 발행 및 공시등에 관한 규정 시행세칙 제4조의 규정에 의거하여 피합병법인의 합병가액은 자산가치와 수익 가치를 1과 1.5의 비율로 가중산술평균한 본질가치를 적용하였습니다. 한편, 주권비상장법인인 피합병법인의 유사회사 선정기준을 충족시키는 유사한 주권상장법인이 없으므로 상대가치를 산정하지 아니합니다. A. 본질가치((ax1+bx1.5)÷2.5): 9,226원 a. 자산가치 : 196원 b. 수익가치 : 15,246원 B. 상대가치 : 해당사항 없음(유사회사 3개 미만) C. 합병가액 : 9,226원 3. 산출결과 합병법인이 피합병법인을 합병함에 있어서 합병비율의 기준이 되는 양 합병당사회사의 주당평가액은 합병법인과 피합병법인이 각각 2,000원(주당 액면가액100원)과 9,226원(주당액면가액 500원)으로 평가되었으며, 이에 따라 양 합병당사회사의 합병비율은 1 : 4.6130000로 평가되었습니다."", ""mg_stn"": ""해당사항없음"", ""mgptncmp_cmpnm"": ""코닉오토메이션 주식회사"", ""mgptncmp_mbsn"": ""반도체/디스플레이 제어 SW, 자동화 설비 솔루션, IT인프라 솔루션"", ""mgsc_mgdt"": ""2022년 07월 13일"", ""rbsnfdtl_sl"": ""27,291,569,216"", ""rbsnfdtl_tast"": ""18,006,119,323""}"
kosdaq_004,393210,01436479,토마토시스템,mna,tangible_asset_acquisition,유형자산 양수 결정,2025-05-08,https://dart.fss.or.kr/dsaf001/main.do?rcpNo=20250508000613,tgastInhDecsn.json,"ast_nm=서울특별시 강남구 역삼동 705-32 소재 토지 및 건물 - 토지면적: 520.6㎡ - 건물면적: 1,999.38㎡ | ast_sen=토지 및 건물 | bddd=2024년 10월 16일 | dl_pym=1) 지급형태: 현금 2) 지급시기 및 지급조건 ① 계약금(2024.10.16): 3,070,000,000원 ② 중도금(2024.12.10): 6,140,000,000원 ③ 잔금(2025.05.13): 21,490,000,000원 3) 자금조달 방법: 보유자금 및 금융기관 차입 | dlptn_cmpnm=토탈스위스코리아 주식회사","{""ast_nm"": ""서울특별시 강남구 역삼동 705-32 소재 토지 및 건물 - 토지면적: 520.6㎡ - 건물면적: 1,999.38㎡"", ""ast_sen"": ""토지 및 건물"", ""bddd"": ""2024년 10월 16일"", ""dl_pym"": ""1) 지급형태: 현금 2) 지급시기 및 지급조건 ① 계약금(2024.10.16): 3,070,000,000원 ② 중도금(2024.12.10): 6,140,000,000원 ③ 잔금(2025.05.13): 21,490,000,000원 3) 자금조달 방법: 보유자금 및 금융기관 차입"", ""dlptn_cmpnm"": ""토탈스위스코리아 주식회사"", ""dlptn_mbsn"": ""건강보조식품, 화장품 등 판매업"", ""exevl_op"": ""적정"", ""inh_af"": ""중장기적 자산가치 제고"", ""inh_pp"": ""업무환경 개선을 위한 사옥 확보"", ""inh_prd_ctr_cnsd"": ""2024년 10월 16일"", ""inhdtl_inhprc"": ""30,700,000,000"", ""inhdtl_tast"": ""37,529,865,240"", ""inhdtl_tast_vs"": ""81.80""}"
kosdaq_004,393890,01291317,더블유씨피,mna,business_acquisition,영업양수 결정,2023-07-25,https://dart.fss.or.kr/dsaf001/main.do?rcpNo=20230725000487,bsnInhDecsn.json,"ast_cmp_all=1,078,240,739,103 | ast_inh_bsn=74,433,000,000 | ast_rt=6.90 | bddd=2023년 07월 25일 | dlptn_cmpnm=더블유스코프코리아 주식회사","{""ast_cmp_all"": ""1,078,240,739,103"", ""ast_inh_bsn"": ""74,433,000,000"", ""ast_rt"": ""6.90"", ""bddd"": ""2023년 07월 25일"", ""dlptn_cmpnm"": ""더블유스코프코리아 주식회사"", ""dlptn_mbsn"": ""이차전지용 분리막 제조 및 판매"", ""dlptn_rl_cmpn"": ""계열회사"", ""exevl_op"": ""당 법인은 평가를 실시함에 있어 평가대상사업부의 가치에 대하여 수익접근법 중 미래현금흐름할인법(DCF법: Discounted Cash Flow Method)에 의하여 평가를 수행하였습니다. 당 법인은 평가대상사업부가 제시한 재무자료 및 사업계획, 평가대상사업부가 속한 회사 및 귀사 경영진과의 인터뷰, 미래 투자계획 및 영업계획, 각종 통계자료 및 관련 업계의 시장분석자료 등을 활용하였습니다. 본 의견서에 기술된 당 법인의 분석에 기초한 결과, 평가기준일 현재 평가대상사업부의 영업가치는 55,960백만원에서 61,603 백만원의 범위로 산출되었으며, 실제 평가대상사업부의 거래예정가액은 57,633백만원으로 중요성의 관점에서 부적정하다고 판단할만한 근거가 발견되지 아니하였습니다."", ""inh_af"": ""사업영역 확장 및 경영 효율성 증대"", ""inh_bsn"": ""더블유스코프코리아 주식회사의 코팅분리막 제조사업부문 (3공장)"", ""inh_bsn_mc"": ""이차전지 소재 중 코팅 분리막을 제조하여 수요처에 납품하는 영업 및 이에 관련된 영업"", ""inh_pp"": ""공정 일원화를 통한 기업가치 및 주주가치 증대"", ""inh_prc"": ""57,633,000,000"", ""inh_prd_ctr_cnsd"": ""2023년 07월 25일"", ""n6m_tpai_plann"": ""아니오"", ""sl_cmp_all"": ""257,451,425,430"", ""sl_inh_bsn"": ""91,828,172,918"", ""sl_rt"": ""35.67""}"
